Smart City is the city that connects the people to everything that?s most important to make their lives easier. Through the Alba Iulia Smart City Pilot Project the city and its citizens benefit from the advantages provided by the new and innovative technologies. Alba Iulia Smart City is a project through which companies from various fields, especially IT, creative and communications industries are testing intelligent solutions that meet the diverse needs of the local community. On the one hand, through this way of collaboration the citizens are benefiting from new services and from immediate or indirect benefits provided by the intelligent solutions that are being tested, and the municipality develops future plans and strategies, being endowed with concrete data and tangible benefits of the solutions tested. On the other hand, companies, start-ups, academic actors or other partner entities have the opportunity to ?try? the performance of their products and services in a real environment, thus having the opportunity to build a scalable business model, which can be replicated in any other city from Romania or abroad. Through the Smart City pilot project, we aim to increase the quality of our inhabitants? lives and to show that the infrastructure of future cities will not mean only the basic utilities with which a city operates. The widespread use of smart technologies transforms communities as a whole and also the way in which people interact with their own city. These are, in fact, the premises of a smart city: the channeling of technological advantages towards the concrete needs of the city and the possibility for citizens to make the most of the implemented solutions, either directly or indirectly. With the occasion of celebrating the Centenary Year in Alba Iulia ? ?The city where the future was born? ? we will place the digital foundation for another 100 years of Romania, celebrating 100 years of living history. Alba Iulia deserves to become a more communicative, business-friendly city, more integrative for better ergonomics and mobility, more accessible due to the intelligent solutions, more competitive, creative, efficient, productive and more inclusive for citizens. All the above mentioned will contribute, with the involvement of smart technologies, to the improvement of the  quality of life, improving public services and making the relationship between the community and municipality more transparent.
Explore Transylvanian highlights away from the tourist crowds and benefit from your guide?s undivided attention on a private tour of Corvin Castle and Alba Iulia, leaving the hustle and bustle of the city behind as you gain insight into the wider region?s history and culture from your guide. Travel with ease between dispersed locations via air-conditioned vehicle, and save time finding a meeting point with included hotel pickup and drop-off.
Bulevardul Revolu?iei 1989,Nr.31 510024 Alba Iulia Get Directions Highlights info row image 0758 700 453 Highlights info row image Typically replies within a few hours Send message Highlights info row image Restaurant Highlights info row image Opens on Monday Closed now Highlights info row image Suggest Edits
Alba Iulia (Romanian pronunciation: [?alba ?juli.a] (About this soundlisten); German: Karlsburg or Carlsburg, formerly Wei?enburg, Hungarian: Gyulafeh?rv?r, Latin: Apulum,[2] Ottoman Turkish: Erdel Belgrad? or Belgrad-? Erdel) is the seat of Alba County in the west-central part of Romania. Located on the Mure? River in the historical region of Transylvania, it has a population of 63,536 (as of 2011).[3] Since the High Middle Ages, the city has been the seat of Transylvania's Roman Catholic diocese. Between 1541 and 1690 it was the capital of the Eastern Hungarian Kingdom and the latter Principality of Transylvania. At one point it also was a center of Eastern Orthodox Metropolitan of Transylvania with suffragan to Vad diocese.[4][5] Alba Iulia is historically important for Romanians, Hungarians, and Transylvanian Saxons. In December 2018, Alba Iulia was officially declared Capital of the Great Union of Romania.[6] The city administers four villages: B?r?ban? (Borb?nd), Mice?ti (Ompolykisfalud), Oarda (Als?v?radja) and P?cli?a (Poklos).
The Alba Carolina Citadel (Romanian: Cetatea Alba Carolina) is a star-shaped Romanian fortress located in Alba Iulia.[2][3][4][5][6][7] Its construction commenced on November 4, 1715 during the Habsburg rule in Transylvania, and was completed in 1738. 20,000 serfs were involved in its construction, which is estimated to have cost around 3 million guldens. The citadel was built on the site of 2 other fortifications? the legionary fortress of Legio XIII Gemina, as well as the medieval Balgrad citadel.
The Alba Carolina Citadel (Romanian: Cetatea Alba Carolina) is a star-shaped Romanian fortress located in Alba Iulia.[2][3][4][5][6][7] Its construction commenced on November 4, 1715 during the Habsburg rule in Transylvania, and was completed in 1738. 20,000 serfs were involved in its construction, which is estimated to have cost around 3 million guldens. The citadel was built on the site of 2 other fortifications? the legionary fortress of Legio XIII Gemina, as well as the medieval Balgrad citadel.
Back in the XVIII century, when the Marquis de Vauban designed and implemented a revolutionary system of fortifications and defenses, little did he know that his designs would earn him international recognition throughout the centuries, as today there are tens of citadels built by the system that bears his name. One of the most spectacular such fortresses of this type is Alba Carolina ? the largest citadel in Romania, located in the city of Alba Iulia. Such is the complexity of this ample landmark that, for the sake of convenience, visits to the citadel have been organized into six separate tours, each with a theme of its own. One of these tours is dedicated to the heroic figures of Horea, Closca, and Crisan, leaders of a major peasant revolt of the XVIII century. It includes the prison cell that Horea was detained in, embedded in the pedestal of the grand statue representing the Austrian emperor Carol VI ? erected at Gate III of the Alba Carolina citadel ? as well as the gaols, located on the south-eastern flank of the Eugene of Savoy bastion, complete with the scaffold where Horea and Closca were executed on a breaking wheel. Another tour walks visitors through the seven gates of the Vaubam citadel, as well as the various constructions of historical importance located nearby. Each of the gates has something worthy to be noted: Gate I, for instance, is beautifully shaped as a triumphal arch; Gate II has three entries, open in the upper half; Gate III, the largest and most impressive of them, is decorated with intricate carvings on both facades; Gate IV is the only one of the west side gates that was honored with Baroque style decorations; Gate V, built in a deceptively simple style, is completed by a bridge that connects the Saint Michael ravelin to the counterguard; Gate VI has earned its fame as the King?s Gate since it served as entry to king Ferdinand and queen Mary on their coronation day; finally, Gate VII, which was only recently uncovered, is a massive tunnel that was used both for procurement purposes and to allow the cavalry to exit the citadel in large numbers when urgent action was required. A third and fourth tour focus on the southern and northern sides of the defense moat surrounding the fortress, which constitutes a genuine dendrological park thanks to the over 70 species of plants and shrubs growing here. The northern tour has the added attraction of two superbly landscaped gardens, a Roman one and a Japanese one, as well as a statue of a XVIII century drummer. However, by far the most spectacular of all the sights is the star-shaped citadel itself, a monumental construction that can be visited in its entire splendor in the tour of the three fortifications. To go on this tour is to enjoy is like enjoying a live lesson in history and military engineering. The three fortifications that give the tour its name refer to the fact that, as it stands today, the Alba Carolina citadel is a series of three successive constructions, each of them incorporating fragments from the previous one. The oldest is the Roman castrum, followed by the medieval stronghold, further expanded in the XVIII century into a Vauban citadel. The mastermind of this latter project was prince Eugene of Savoy, who, however, failed to complete the construction, choosing to redirect funds towards other fortifications before having erected the fourth line of defense. Further works were carried out towards the end of the XVIII century under the supervision of general Bohn, but these too were interrupted before reaching their full completion.
Alba Mall, the largest shopping center in the county, opens its doors in 2007 with thousands of people eager to see, experiment, buy and enjoy what has been created for them. Thinking from the start as an atypical building from classic shopping centers, Alba Mall shows personality, innovation and style. It was created as a "city in the city" and is totally found in this formula: mini-streets, promenade areas or miniature markets. The food court area, children's playgrounds, international brands to which Alba-Iulians have direct access here at their home make the Alba Mall not only a favorite shopping area but also a real social space, a meeting place for friends , where shopping complements with relaxation and fun with top events. The shopping center has over 100 stores, including 16 restaurants and cafes, with a total rental surface of 19,500sqm and over 400 parking spaces. It also has a Ballroom, an inspired choice for: fast-time weddings, successful private parties, high-class conferences, or business meetings. The only multiplex in the Alba and Sibiu counties, COLORS CINEMA 3D, offers filmmakers a cinematic experience at high standards of quality and comfort, and Carrefour Market offers its clients low prices and a wide range of products and promotions. Alba Mall has not stopped at any moment since the first buyer has passed the threshold so far, reinventing, listening to its customers and constantly adapting to their needs and their desire to have all the facilities here in a few steps From home.
Gradinita cu program normal ?Emanuel? isi propune promovarea si cultivarea, inca de la varsta prescolaritatii, a valorilor crestin-morale necesare unei bune integrari in viata sociala in general, precum si responsabilizarea copiilor in a-si forma un comportament altruist, bazat pe credinta in Dumnezeu si a manifestarii acesteia prin comportamente pro-sociale. Dorim ca timpul petrecut de prescolari in gradinita sa fie pentru copii, o experienta pozitiva din care sa beneficieze de resursele necesare pentru a deveni intr-adevar oameni de n?dejde pentru societatea de maine si pentru a trai cu demnitate Din specificul gradinitei face parte si optionalul de educatie crestina?Micul Crestin?.
Tipul institutiei: Scoala cu clasele I-VIII
Municipiul Alba Iulia fiind o zona cu obietive turistice duce implicit la cresterea numarului calatorilor si a turistilor care solicita serviciile diferitelor autogari din Alba Iulia. Datorita zonei istorice a orasului, autogarile din Alba Iulia au un flux continuu de persoane.  Diferite autogari din Alba Iulia desfasoara zilnic curse cu plecare spre regiuni nationale si internationale. Autogarile din Alba Iulia incearca sa ofere calatorilor conditii de transport public pe masura asteptarilor lor. Mersul autobuzelor si autocarelor se desfasoara conform orarului stabilit. Rezervarea biletelor se poate face telefonic la diferite autogari din Alba Iulia sau direct de la autogara respectiva. Informatii Autogari Alba Iulia Autogara Autotrans Adresa: Str. Iasilor, Nr. 94 Telefon: 0258/812967 Fax: 0258/812967
cauta produse precum bere, tv, mobila, scutece
Preparatele buc?t?riei Restaurantului La Dolce Vita sunt bogate prin diversitatea felurilor de m?ncare ?i re?ete tradi?ionale vechi, f?cute din lucruri simple, dar gustoase ?i consistente. Renumele buc?t?riei Restaurantului La Dolce Vita este dat de varietatea pastelor f?cute ?n cas?: tagliatele, tortelini, ravioli, farfale, strozzapreti, toate diferite, realizate cu ingrediente simple, f?in? de gr?u, ou? proaspete, lucrate, t?iate ?i modelate manual. De asemenea, exist? nenum?rate re?ete de carne de porc, pui, m?nzat, iepure, pe?te, fructe de mare, preg?tite ?n diferite variante, dar mereu respect?nd valoarea simplit??ii ?i autenticit??ii, pentru a spori gustul ?i aroma acestora, a?adar? Bine a?i venit La Dolce Vita.
The gentle climate and the richness of the soil made the area around Alba Iulia inhabitable since ancient times and established Alba as a leading wine growing region since 1st century AD. Northwest of Alba Iulia are the Apuseni Mountains and in the east the Transylvanian Plateau with its rolling hills and deep, wide valleys. Alba IuliaOne of the oldest settlements in Romania, known in ancient time as Apulum, Alba Iulia served as the largest military and economic center during the Roman occupation. Temples, mosaics, thermae and statues, amphitheaters, the governor's palace "Daciarum Trium" ? all rendered the original Dacian Apulul as the miniature copy of the mother Rome. An Episcopal citadel and an important political, military and cultural center, Alba Iulia reached its peak between 1542-1690, serving as the capital of the independent Principality of Transylvania and the residence of the Transylvanian princes. In 1599, Mihai Viteazul (Michael the Brave) achieved here for a brief period of time the union of the three main provinces of Romania: Walachia, Transylvania, and Moldavia. The town later became an important printing centre. Nowadays the local universities continue the tradition of the old academic schools. The peasant revolt led by Horea, Closca and Crisan, executed on February 28, 1785 on the Pitchfork Hill (Dealul Furcii) turned the city into a symbol of the fight for justice and freedom. It was here that on December 1st 1918 the province of Transylvania announced its unification with Romania. In 1922 Prince Ferdinand was crowned King of Romania in an act which mirrored the union achieved more than four centuries earlier by Mihai Viteazul.
The Apuseni Mountains (Romanian: Mun?ii Apuseni, Hungarian: Erd?lyi-k?z?phegys?g) is a mountain range in Transylvania, Romania, which belongs to the Western Romanian Carpathians, also called Occidentali in Romanian. Their name translates from Romanian as Mountains of the sunset i.e. western. The highest peak is Cucurb?ta Mare (Hungarian: Nagy-Bihar) at 1849 metres, also called Bihor Peak. The Apuseni Mountains have about 400 caves.
Alba County (Romanian pronunciation:?[?alba]) is a county (jude?) of Romania, in Transylvania, its capital city being Alba-Iulia with a population of 63,536.[1]
?ara Mo?ilor (German: Motzenland), also known as ?ara de Piatr? (The Stone Land) is an ethnogeographical region of Romania in the Apuseni Mountains, on the upper basin of the Arie? and Cri?ul Alb River rivers. It covers parts of the Alba, Arad, Bihor, Cluj and Hunedoara counties of Romania and a section of it forms the Apuseni Natural Park.
Alba County (Romanian pronunciation:?[?alba]) is a county (jude?) of Romania, in Transylvania, its capital city being Alba-Iulia with a population of 63,536.[1]
Detunatele is a site of columnar jointing in Transylvania, Alba County, Romania. Detunatele means lightning strike. The columns are hexagonal shaped basalt and 1,258 meters tall on two peaks: Detunata Goala and Detunata Flocoasa (Barren Detunata and Shaggy Detunata). They are located in the Metaliferi Mountains and are a tourist attraction. They are 1.5?km apart. They formations are shaped like humps and there are stories and legends associated with them.[1]
Alba County (Romanian pronunciation:?[?alba]) is a county (jude?) of Romania, in Transylvania, its capital city being Alba-Iulia with a population of 63,536.[1]
Alba County (Romanian pronunciation:?[?alba]) is a county (jude?) of Romania, in Transylvania, its capital city being Alba-Iulia with a population of 63,536.[1]
Ocna Mure? (Romanian pronunciation:?[?okna ?mure?]; Latin: Salinae, Hungarian: Maros?jv?r, German: Miereschhall) is a town in Alba County, Romania, located in the north-eastern corner of the county, near the Mure? River, with a population of 15,503 inhabitants as of 2002. The town is situated next to a large deposit of salt, mined in the past until the ceiling of the mines collapsed from water infiltration in 1978. Ocna Mure? has a chlorosodic products plant,a salt extraction plant and a spa which uses the salty water from the former mines.
According to the census from 2011 there was a total population of 12,337 people living in this town. Of this population, 83.46% are ethnic Romanians, 9.31% are ethnic Hungarians and 7% ethnic Romani.[1]
N/A
Respectul pentru ceea ce facem, discre?ia ?i profesionalismul cu care abord?m fiecare situa?ie ?n parte, ne recomand?. Apela?i-ne cu ?ncredere.
T?mpl?rie pvc, aluminiu profile de top. u?i de interior, metalice de garaj. Duration varies ? 50-10.000 accesorii pvc, feronerie, broa?te, jaluzele verticale, rulouri textile, calitate. livrare ?i montaj... 
The page Ocna mure? resort does not exist. You can ask for it to be created, but consider checking the search results below to see whether the topic is already covered.
Alba County (Romanian pronunciation:?[?alba]) is a county (jude?) of Romania, in Transylvania, its capital city being Alba-Iulia with a population of 63,536.[1]
Alba County (Romanian pronunciation:?[?alba]) is a county (jude?) of Romania, in Transylvania, its capital city being Alba-Iulia with a population of 63,536.[1]
Str. Steagului, Nr. 62A, jud. Arad
Arad (Romanian pronunciation:?[a?rad] (listen); Hungarian: Arad; Serbian: ????/Arad) is the capital city of Arad County, historically situated in the region of Cri?ana, and having extended into the neighboring Banat region in the 20th century.[2] Arad is the third largest city in Western Romania, behind Timi?oara and Oradea, and the 12th largest in Romania, with a population of 159,704.
The Mure? Floodplain Natural Park, set aside by the Romanian government in 2005, is located in western Romania outside the city of Arad. The park covers 17,455 ha and follows the Mure? River westward from the city of Arad to the Hungarian border. The park is a typical ecosystem for wetlands, with running waters, lakes, swamps and floodplains, with forests, an important place for the passage and nesting of bird species and is subjected to periodical floods (a flood every three years). The forests (7,500 ha) in the park are made up primarily of common oak, narrow-leafed ash, black and white poplar, white willow, and American black walnut. This area is an important place for nesting and passage for nearly 200 species of birds, most of which are strictly protected internationally.
The page Bezdin monastery does not exist. You can ask for it to be created, but consider checking the search results below to see whether the topic is already covered.
Arad County (Romanian pronunciation:?[a?rad] (listen)) is an administrative division (jude?) of Romania roughly translated into county in the western part of the country on the border with Hungary, mostly in the region of Cri?ana and few villages in Banat. The administrative center of the county lies in the city of Arad. The Arad County is part of the Danube?Cri??Mure??Tisa Euroregion.
The page Lipova resort and city does not exist. You can ask for it to be created, but consider checking the search results below to see whether the topic is already covered.
Arad County (Romanian pronunciation:?[a?rad] (listen)) is an administrative division (jude?) of Romania roughly translated into county in the western part of the country on the border with Hungary, mostly in the region of Cri?ana and few villages in Banat. The administrative center of the county lies in the city of Arad. The Arad County is part of the Danube?Cri??Mure??Tisa Euroregion.
Pensiunea Montana Resort va ofera cazare ?n Colibi?a (la 40 km de Bistri?a), ?ntr-o zon? montan? deosebit?, ?n mijlocul peisajului spectaculos oferit de Mun?ii C?limani si Lacul de Acumulare Colibita.  Colibi?a (jud. Bistri?a-N?s?ud) este o sta?iune climateric? situat? la 900 m altitudine, binecunoscut? pentru aerul puternic ionizat.  Vila se afl? la 5 minute de Lacul Colibi?a, pe un teren de 5000 mp, cu parcare proprie si terasa- restaurant.In aceeasi curte se afla Centrul Spa Montana, cu piscina interioara incalzita, diferite saune, jacuzzi.  Vila dispune de doua sali de luat masa pentru 22 de persoane fiecare, TV, videoproiectar, ecran de 200x220, WiFi, 17 dormitoare pentru 43 de persoane,cu baie proprie; central? termic? proprie. Finisajele includ gresie, faian??, lemn ?i piatr?. Masa se poate servi a la carte in restaurantul nostru. Vila este racordat? la re?eaua de ap?, de canalizare, electric?. Zona ofer? vaste posibilit??i de destindere pentru iubitorii muntelui, ?n orice anotimp: excursii, drume?ii (T?ul Z?nelor, izvorul de ap? mineral? Borcut, trasee montane - traseu marcat de 3,5 ore p?na ?n Vf. Bistricioru, Castel Dracula l?ng? Pasul Tihu?a - 1100 m alt), ciclism montan, caiac, alpinism, pescuit (p?str?v, clean, caras - ?n lacul Colibi?a), plimb?ri cu sania etc. 
Moneasa (Hungarian: Menyh?za) is a commune in Arad County, Romania, is situated at the foot of Codru-Moma Mountains. Its administrative surface stretches over 6824 hectares and it is composed of two villages, Moneasa (situated at 102?km from Arad) and R?nu?a (Kisr?na).
Arad County (Romanian pronunciation:?[a?rad] (listen)) is an administrative division (jude?) of Romania roughly translated into county in the western part of the country on the border with Hungary, mostly in the region of Cri?ana and few villages in Banat. The administrative center of the county lies in the city of Arad. The Arad County is part of the Danube?Cri??Mure??Tisa Euroregion.
Jupiter City Shopping Center ? cel mai mare mall din Pitesti si judetul Arges, locul in care fiecare vizita se transforma intr-o experienta completa, o destinatie ideala pentru shopping!
N/A
N/A
N/A
Din data de 23 februarie 2009, la nivelul O.C.P.I. Arge? s-a implementat sistemul integrat de Cadastru ?i Publicitate Imobiliar? e-Terra
N/A
N/A
N/A
Gara a fost inaugurat? pe 13 septembrie 1872, ?n acela?i timp cu darea ?n folosin?? a liniei de cale ferat? Pite?ti-Chitila-Bucure?ti. Aceast? cl?dire este ultimul supravie?uitor al seriei de cl?diri construite ?n 1872 de consor?iul prusac al antreprenorului Bethel Henry Strousberg pentru c?ile ferate rom?ne. Gara veche a fost demolat? iar ?n locul acesteia s-a construit o gar? modern?. Noua gar? finalizat? ?n anul 2016 este o cladire par?ial suspendat?, ?ntinz?ndu-se peste liniile de cale ferat?, astfel ?ncat peroanele se afl? sub cl?dire, iar trenurile opresc sub aceasta. Aceasta are peste 1.000 de metri p?tra?i ?i dou? etaje. Gara are ?i un minimall ?n sala de a?teptare, cu multe magazine, sc?ri rulante ?i lifturi cu o capacitate de 15 persoane care ?i duc pe c?l?tori pe peroane. ?n apropiere vor fi amenajate spa?ii de parcare. Cl?direa include, la nivelul etajului ?ntai, un pasaj care face leg?tura ?ntre cartierul Tudor Vladimirescu ?i gar?.
N/A
N/A
N/A
N/A
Pite?ti (Romanian pronunciation:?[pi?te?t?]) is a city in Romania, located on the Arge? River. The capital and largest city of Arge? County, it is an important commercial and industrial center, as well as the home of two universities. Pite?ti is situated in the historical region of Muntenia. It lies on the A1 freeway connecting the city directly to the national capital Bucharest, being an important railway junction, with a classification yard in nearby B?lile?ti. The city houses the Arpechim oil refinery, and is a marketing center for the automotive industry, in particular Automobile Dacia.
Curtea de Arge? (Romanian pronunciation:?[?kurte?a de ?ard??e?] (listen)) is a city in Romania on the left bank of the Arge? River, where it flows through a valley of the lower Carpathians (the F?g?ra? Mountains), on the railway from Pite?ti to the Turnu Ro?u Pass. It is part of Arge? County. The city also administers one village, Noapte?.
Ruc?r is a commune in the north-eastern part of Arge? County, Romania. At the 2002 census, the population of the commune was 6,207. It is composed of two villages, Ruc?r and S?tic. Located on the Bran-Ruc?r pass, it is popular with tourists from Bran Castle.
The page F?g?ra? mountains ? transf?g?r??an does not exist. You can ask for it to be created, but consider checking the search results below to see whether the topic is already covered.
The Leaota Mountains are located in central Romania, north of the city T?rgovi?te. They are part of the Southern Carpathians group of the Carpathian Mountains, and have as neighbours the Bucegi Mountains to the east and Piatra Craiului to the west.
Coordinates: 45?21?13.49?N 24?38?6.80?E? / ?45.3537472?N 24.6352222?E
Coordinates: 45?21?13.49?N 24?38?6.80?E
Comana Monastery (Romanian: M?n?stirea Comana) is a Romanian Orthodox monastery in Comana, Giurgiu County, Romania.
The page Cotmeana monastery does not exist. You can ask for it to be created, but consider checking the search results below to see whether the topic is already covered.
One?ti (Romanian pronunciation:?[o?ne?t?]; Hungarian: ?nfalva) is a city in Bac?u County, Romania, with a population of 39,172 inhabitants. It is situated in the historical region of Western Moldavia.
COOKIES
